{
  "$schema": "https://json-schema.org/draft/2020-12/schema",
  "title": "library-v5",
  "type": "object",
  "properties": {
    "schemaVersion": {
      "const": 5
    },
    "uuid": {
      "type": "string",
      "pattern": "^[0-9A-F]{8}-[0-9A-F]{4}-[0-9A-F]{4}-[0-9A-F]{4}-[0-9A-F]{12}$"
    },
    "iconId": {
      "type": [
        "string",
        "null"
      ]
    },
    "data": {
      "type": "array",
      "items": {
        "type": "object",
        "properties": {
          "locale": {
            "type": "string",
            "minLength": 1
          },
          "data": {
            "type": "object"
          }
        },
        "required": [
          "locale",
          "data"
        ],
        "additionalProperties": true
      }
    },
    "matchers": {
      "type": "array",
      "items": {
        "type": "object",
        "properties": {
          "id": {
            "type": "integer",
            "minimum": 1,
            "maximum": 2147483647
          },
          "type": {
            "type": "integer",
            "minimum": 0,
            "maximum": 9
          },
          "name": {
            "type": "string",
            "minLength": 1,
            "maxLength": 1024
          },
          "mode": {
            "enum": [
              "exact",
              "regex"
            ]
          },
          "priority": {
            "type": "integer",
            "minimum": 0,
            "maximum": 2147483647
          },
          "label": {
            "type": "string",
            "minLength": 1
          },
          "iconId": {
            "type": [
              "string",
              "null"
            ]
          },
          "regexName": {
            "type": [
              "string",
              "null"
            ]
          },
          "hasDetail": {
            "type": "boolean"
          },
          "legacyPath": {
            "type": [
              "string",
              "null"
            ]
          },
          "examples": {
            "type": "object",
            "properties": {
              "positive": {
                "type": "array",
                "items": {
                  "type": "string"
                }
              },
              "negative": {
                "type": "array",
                "items": {
                  "type": "string"
                }
              }
            },
            "required": [
              "positive",
              "negative"
            ],
            "additionalProperties": false
          },
          "detailData": {
            "type": "array",
            "items": {
              "type": "object",
              "properties": {
                "locale": {
                  "type": "string",
                  "minLength": 1
                },
                "data": {
                  "type": "object"
                }
              },
              "required": [
                "locale",
                "data"
              ],
              "additionalProperties": true
            }
          }
        },
        "required": [
          "id",
          "type",
          "name",
          "mode",
          "priority",
          "label",
          "iconId",
          "regexName",
          "hasDetail",
          "legacyPath",
          "examples"
        ],
        "additionalProperties": true
      }
    },
    "unreferencedDescriptions": {
      "type": "array",
      "items": {
        "type": "object",
        "properties": {
          "path": {
            "type": "string"
          },
          "payload": {
            "type": "object",
            "properties": {
              "uuid": {
                "type": "string",
                "pattern": "^[0-9A-F]{8}-[0-9A-F]{4}-[0-9A-F]{4}-[0-9A-F]{4}-[0-9A-F]{12}$"
              },
              "data": {
                "type": "array",
                "items": {
                  "type": "object",
                  "properties": {
                    "locale": {
                      "type": "string",
                      "minLength": 1
                    },
                    "data": {
                      "type": "object"
                    }
                  },
                  "required": [
                    "locale",
                    "data"
                  ],
                  "additionalProperties": true
                }
              }
            },
            "required": [
              "uuid",
              "data"
            ],
            "additionalProperties": true
          }
        },
        "required": [
          "path",
          "payload"
        ],
        "additionalProperties": true
      }
    }
  },
  "required": [
    "schemaVersion",
    "uuid",
    "iconId",
    "data",
    "matchers",
    "unreferencedDescriptions"
  ],
  "additionalProperties": true
}
