{
  "schemaVersion": 5,
  "uuid": "E43C0CDE-82F3-4A7A-BE14-0F71DBEC3D4E",
  "iconId": null,
  "data": [
    {
      "locale": "zh-Hans",
      "data": {
        "label": "翼支付",
        "dev_team": "China Telecom",
        "rule_contributors": [
          "Absinthe"
        ],
        "description": "翼支付是天翼电子商务有限公司旗下品牌，覆盖餐饮娱乐、交通出行、电商购物、民生缴费、通信交费等多个生活消费场景的便民服务。",
        "source_link": "https://www.bestpay.com.cn/"
      }
    },
    {
      "locale": "en",
      "data": {
        "label": "YiPay",
        "dev_team": "China Telecom",
        "rule_contributors": [
          "Absinthe"
        ],
        "description": "Yi Payment is a brand under Tianyi E-Commerce Co., Ltd., covering various life consumption scenarios such as catering and entertainment, transportation, e-commerce shopping, utility bill payment, and communication fee payment.",
        "source_link": "https://www.bestpay.com.cn/"
      }
    }
  ],
  "matchers": [
    {
      "id": 339,
      "type": 2,
      "name": "com.bestpay.app.H5PayActivity",
      "mode": "exact",
      "priority": 339,
      "label": "翼支付",
      "iconId": null,
      "regexName": null,
      "hasDetail": true,
      "legacyPath": "activities-libs/com/bestpay/app/H5PayActivity.json",
      "examples": {
        "positive": [
          "com.bestpay.app.H5PayActivity"
        ],
        "negative": []
      }
    }
  ],
  "unreferencedDescriptions": []
}
