{
  "schemaVersion": 5,
  "uuid": "145D0BA4-8D0F-465E-BF0E-197F699EA4B6",
  "iconId": "ic_lib_callstack_media_kit",
  "data": [
    {
      "locale": "zh-Hans",
      "data": {
        "label": "React Native Slider",
        "dev_team": "Callstack",
        "rule_contributors": [
          "sebastien46"
        ],
        "description": "一个 React Native 组件，分别封装了 iOS 的 Slider 和 Android 的 SeekBar。",
        "source_link": "https://github.com/callstack/react-native-slider"
      }
    },
    {
      "locale": "en",
      "data": {
        "label": "React Native Slider",
        "dev_team": "Callstack",
        "rule_contributors": [
          "sebastien46"
        ],
        "description": "React Native component exposing Slider from iOS and SeekBar from Android.",
        "source_link": "https://github.com/callstack/react-native-slider"
      }
    }
  ],
  "matchers": [
    {
      "id": 2659,
      "type": 0,
      "name": "libreact_codegen_RNCSlider.so",
      "mode": "exact",
      "priority": 2659,
      "label": "React Native Slider",
      "iconId": "ic_lib_callstack_media_kit",
      "regexName": null,
      "hasDetail": true,
      "legacyPath": "native-libs/libreact_codegen_RNCSlider.so.json",
      "examples": {
        "positive": [
          "libreact_codegen_RNCSlider.so"
        ],
        "negative": []
      }
    }
  ],
  "unreferencedDescriptions": []
}
