{
  "schemaVersion": 5,
  "uuid": "72387397-E1AF-47DC-8855-C876D8FBB668",
  "iconId": null,
  "data": [
    {
      "locale": "zh-Hans",
      "data": {
        "label": "react-native-mmkv",
        "dev_team": "margelo",
        "rule_contributors": [
          "coder-xiaomo",
          "crrashh1542"
        ],
        "description": "react-native-mmkv 是一个库，可让你通过到原生 C++ 库的快速直接 JS 绑定，在 React Native 应用中轻松使用 MMKV。",
        "source_link": "https://github.com/margelo/react-native-mmkv"
      }
    },
    {
      "locale": "en",
      "data": {
        "label": "react-native-mmkv",
        "dev_team": "margelo",
        "rule_contributors": [
          "coder-xiaomo",
          "crrashh1542"
        ],
        "description": "react-native-mmkv is a library that allows you to easily use MMKV inside your React Native app through fast and direct JS bindings to the native C++ library.",
        "source_link": "https://github.com/margelo/react-native-mmkv"
      }
    }
  ],
  "matchers": [
    {
      "id": 2767,
      "type": 0,
      "name": "libNitroMmkv.so",
      "mode": "exact",
      "priority": 2767,
      "label": "react-native-mmkv",
      "iconId": null,
      "regexName": null,
      "hasDetail": true,
      "legacyPath": "native-libs/libNitroMmkv.so.json",
      "examples": {
        "positive": [
          "libNitroMmkv.so"
        ],
        "negative": []
      }
    },
    {
      "id": 2932,
      "type": 0,
      "name": "libreactnativemmkv.so",
      "mode": "exact",
      "priority": 2932,
      "label": "react-native-mmkv",
      "iconId": null,
      "regexName": null,
      "hasDetail": true,
      "legacyPath": "native-libs/libreactnativemmkv.so.json",
      "examples": {
        "positive": [
          "libreactnativemmkv.so"
        ],
        "negative": []
      }
    }
  ],
  "unreferencedDescriptions": []
}
