{
  "schemaVersion": 5,
  "uuid": "321F7C3B-21A5-47AE-9D1E-20EFB840224B",
  "iconId": null,
  "data": [
    {
      "locale": "zh-Hans",
      "data": {
        "label": "Foxit PDF SDK",
        "dev_team": "Foxit",
        "rule_contributors": [
          "binx6"
        ],
        "description": "Foxit PDF SDK for Android 致力于帮助开发人员快速将强大的 Foxit PDF 技术集成到他们自己的移动端应用程序中。通过 Foxit 开发包，即使是对 PDF 了解有限的开发人员也可以在 Android 平台上用几行代码快速构建一个专业的 PDF 阅读器。有关更多详细信息，可以访问网站https://developers.foxitsoftware.cn/pdf-sdk/。",
        "source_link": "https://developers.foxit.com/"
      }
    },
    {
      "locale": "en",
      "data": {
        "label": "Foxit PDF SDK",
        "dev_team": "Foxit",
        "rule_contributors": [
          "binx6"
        ],
        "description": "Foxit PDF SDK for Android aims to help developers quickly integrate powerful Foxit PDF technology into their own mobile applications. With the Foxit development kit, even developers with limited PDF knowledge can quickly build a professional PDF reader on the Android platform with just a few lines of code. For more details, you can visit the website https://developers.foxitsoftware.cn/pdf-sdk/.",
        "source_link": "https://developers.foxit.com/"
      }
    }
  ],
  "matchers": [
    {
      "id": 1611,
      "type": 0,
      "name": "librdk.so",
      "mode": "exact",
      "priority": 1611,
      "label": "Foxit PDF SDK",
      "iconId": null,
      "regexName": null,
      "hasDetail": true,
      "legacyPath": "native-libs/librdk.so.json",
      "examples": {
        "positive": [
          "librdk.so"
        ],
        "negative": []
      }
    }
  ],
  "unreferencedDescriptions": []
}
