{
  "schemaVersion": 5,
  "uuid": "5EC1D41C-F0E8-4DAA-BCDC-A07452514D9D",
  "iconId": null,
  "data": [
    {
      "locale": "zh-Hans",
      "data": {
        "label": "vad",
        "dev_team": "思必驰科技股份有限公司",
        "rule_contributors": [
          "WOLFRAZOR"
        ],
        "description": "DUI 致力于构建以场景服务为基础，针对智能家居、车载、机 器人、微信、客服、APP 等泛物联网领域，以用户为中心的自由人机交互系统，支持自由调用图文、列表、音乐、内嵌网页等多种控件，提供从唤醒、语音识别、 语义理解到对话管理、内容输出、TTS 播报的全链路技术的超高度定制；基于“云+端”的整体实现方案和完整的开发者服务，以对话（Dialog）为核心，从语音语言技术到对话管理、技能服务、交互界面均可以定制，VUI（Voice User Interface 语音用户界面）和 GUI（Graphical User Interface 图形用户界面）的相辅相成，完成“语音+触控”的完美结合。 众所周知，整个语音交互过程涉及从声音采集、前端信号处理、语音唤醒、语音识别、语义理解、智能对话、资源调用、回复内容生成、动作执行、合成音播报的主要环节，DUI系统支持整个全链路的语音技术使用，也支持其中某个或某几个环节，如语音唤醒、语音识别的单独使用或一两个联合使用。",
        "source_link": "https://www.duiopen.com/docs/ct_introduction"
      }
    },
    {
      "locale": "en",
      "data": {
        "label": "vad",
        "dev_team": "思必驰科技股份有限公司",
        "rule_contributors": [
          "WOLFRAZOR"
        ],
        "description": "DUI is dedicated to building a user-centered free human-machine interaction system based on scene services, targeting the smart home, in-vehicle, robotics, WeChat, customer service, app, and other IoT fields. It supports the free invocation of various controls such as images, lists, music, and embedded web pages, providing highly customizable full-link technology from wake-up, voice recognition, semantic understanding to dialogue management, content output, and TTS broadcasting. Based on the 'cloud + end' overall implementation plan and comprehensive developer services, with dialogue (Dialog) as the core, it allows customization from voice language technology to dialogue management, skill services, and interactive interfaces. The complementary relationship between VUI (Voice User Interface) and GUI (Graphical User Interface) achieves a perfect combination of 'voice + touch'. It is well known that the entire voice interaction process involves major stages from sound acquisition, front-end signal processing, voice wake-up, voice recognition, semantic understanding, intelligent dialogue, resource invocation, reply content generation, action execution, to synthesized voice broadcasting. The DUI system supports the use of the entire full-link voice technology, as well as the independent use of certain stages such as voice wake-up or voice recognition, or the combined use of one or two stages.",
        "source_link": "https://www.duiopen.com/docs/ct_introduction"
      }
    }
  ],
  "matchers": [
    {
      "id": 1961,
      "type": 0,
      "name": "libvad.so",
      "mode": "exact",
      "priority": 1961,
      "label": "vad",
      "iconId": null,
      "regexName": null,
      "hasDetail": true,
      "legacyPath": "native-libs/libvad.so.json",
      "examples": {
        "positive": [
          "libvad.so"
        ],
        "negative": []
      }
    }
  ],
  "unreferencedDescriptions": []
}
