{
  "schemaVersion": 5,
  "uuid": "2686F06A-BFC3-415D-83BA-AC3E31C579D5",
  "iconId": "ic_lib_tencent",
  "data": [
    {
      "locale": "zh-Hans",
      "data": {
        "label": "王卡 SDK",
        "dev_team": "Tencent",
        "rule_contributors": [
          "Absinthe",
          "yfdyh000"
        ],
        "description": "本组件用于识别当前用户使用的上网卡是否为王卡。识别后给王卡用户以相应的免流状态提示和王卡身份感知。",
        "source_link": "http://tengxundldocument.gcloud.qq.com/pages/documents/details.html?projectId=204"
      }
    },
    {
      "locale": "en",
      "data": {
        "label": "KingCard SDK",
        "dev_team": "Tencent",
        "rule_contributors": [
          "Absinthe",
          "yfdyh000"
        ],
        "description": "This component is used to identify whether the current user's SIM card is a KingCard. Once identified, KingCard users will receive the corresponding free data usage status prompt and KingCard identity awareness.",
        "source_link": "http://tengxundldocument.gcloud.qq.com/pages/documents/details.html?projectId=204"
      }
    }
  ],
  "matchers": [
    {
      "id": 2517,
      "type": 0,
      "name": "libKcsdk-2.0.9",
      "mode": "exact",
      "priority": 2517,
      "label": "王卡 SDK",
      "iconId": "ic_lib_tencent",
      "regexName": null,
      "hasDetail": true,
      "legacyPath": "native-libs/libKcsdk-2.0.9.json",
      "examples": {
        "positive": [
          "libKcsdk-2.0.9"
        ],
        "negative": []
      }
    },
    {
      "id": 2573,
      "type": 1,
      "name": "tmsdk.common.KcBaseService",
      "mode": "exact",
      "priority": 2573,
      "label": "王卡 SDK",
      "iconId": "ic_lib_tencent",
      "regexName": null,
      "hasDetail": true,
      "legacyPath": "services-libs/tmsdk/common/KcBaseService.json",
      "examples": {
        "positive": [
          "tmsdk.common.KcBaseService"
        ],
        "negative": []
      }
    }
  ],
  "unreferencedDescriptions": [
    {
      "path": "actions-libs/com.tencent.kingcard.calibration.json",
      "payload": {
        "data": [
          {
            "locale": "zh-Hans",
            "data": {
              "label": "王卡 SDK",
              "dev_team": "Tencent",
              "rule_contributors": [
                "Absinthe",
                "yfdyh000"
              ],
              "description": "本组件用于识别当前用户使用的上网卡是否为王卡。识别后给王卡用户以相应的免流状态提示和王卡身份感知。",
              "source_link": "http://tengxundldocument.gcloud.qq.com/pages/documents/details.html?projectId=204"
            }
          },
          {
            "locale": "en",
            "data": {
              "label": "KingCard SDK",
              "dev_team": "Tencent",
              "rule_contributors": [
                "Absinthe",
                "yfdyh000"
              ],
              "description": "This component is used to identify whether the current user's SIM card is a KingCard. Once identified, KingCard users will receive the corresponding free data usage status prompt and KingCard identity awareness.",
              "source_link": "http://tengxundldocument.gcloud.qq.com/pages/documents/details.html?projectId=204"
            }
          }
        ],
        "uuid": "2686F06A-BFC3-415D-83BA-AC3E31C579D5"
      }
    }
  ]
}
